,preview_date,preview_text,url,company,article_time,article_date,article_text
293,23.02.2018,"События предстоящих дней: состоится ВОСА ""ФосАгро"", пройдут СД ""Татнефти"" и ""Норникеля""",https://www.finam.ru/analysis/newsitem/sobytiya-predstoyashix-dneiy-sostoitsya-vosa-fosagro-proiydut-sd-tatnefti-i-nornikelya-20180223-190649/,tatneft-3,19:06,23.02.2018,"В понедельник, 26 февраля, в ходе заседания совета директоров ""Татнефти"" будут рассмотрены вопросы о годовом собрании акционеров, о выборе кандидатов в состав совета директоров и о предложениях в повестку дня ГОСА. Плюс к этому будет рассмотрен вопрос об итогах исполнения бюджета компании за январь 2018 года и состоится утверждение бюджета на март 2018 года. ВТБ опубликует финотчетность за 2017 год по МСФО. Чистая прибыль ВТБ по МСФО за 2016 г. увеличилась в 30,4 раза и составила 51,6 млрд рублей благодаря росту доходов от основной деятельности, включая рост чистых процентных доходов на 43,5%. В повестку внеочередного общего собрания акционеров ""ФосАгро"" включены вопрос о выборе состава совета директоров и о выплате дивидендов. Рекомендация по их выплате в объёме 2,72 млрд рублей из расчёта 21 рубль на обыкновенную акцию (или 7 рублей на ГДР) была дана советом директоров 21 ноября 2017 года. Дата закрытия реестра для участия в собрании – 4 января 2018 года. Состоится закрытие реестра акционеров ""САФМАР Финансовые инвестиции"" для участия в ВОСА. Внеочередное общее собрание акционеров ""САФМАР Финансовые инвестиции"" пройдет 23 марта 2018 года. Совет директоров ""МРСК Урала"" рассмотрит вопросы о выдвижении кандидатур в органы управления и контроля организаций и об утверждении плана-графика мероприятий по снижению просроченной дебиторской задолженности за услуги по передаче электрической энергии и урегулированию разногласий, сложившихся на 1 января 2018 года. В ходе заседания совета директоров ""Газпром нефти"" будет рассмотрен отчет о результатах деятельности департамента внутреннего аудита компании за 2017 год. Совет директоров ""Норникеля"" рассмотрит вопросы о сделке между компанией и ""БазэлЦемент"" и о решении вопроса о сделке ""Кольская ГМК"" с ""Санаторий ""Роза Хутор"". Совета директоров ""Квадры"" рассмотрит вопрос об утверждении бизнес–плана общества на 2018 год в новой редакции. В ходе заседании совета директоров ""Ленэнерго"" будут рассмотрены вопросы об утверждении программы отчуждения непрофильных активов ""Ленэнерго"" в новой редакции и об утверждении порядка организации продажи непрофильных активов компании."
294,13.02.2018,"""ФИНАМ"" повышает рекомендацию по акциям ""Татнефти""",https://www.finam.ru/analysis/newsitem/finam-povyshaet-rekomendaciyu-po-akciyam-tatnefti-20180213-135230/,tatneft-3,13:52,13.02.2018,"Аналитики ГК ""ФИНАМ"" актуализировали прогноз по бумагам ПАО ""Татнефть"" – одной из крупнейших вертикально-интегрированных нефтяных компаний России. На фоне увеличения дивидендных выплат до 50% от чистой прибыли и начала выплаты промежуточных дивидендов рекомендация повышена с ""продавать"" до ""держать"", а целевая цена поднята до 485 рублей по обыкновенным акциям и до 347,8 рублей по привилегированным акциям. Тем не менее, бумаги остаются переоценёнными – прогнозируемый среднесрочный потенциал снижения составляет 13,7%.  ""Татнефть"" традиционно платит одинаковые дивиденды по обыкновенным и привилегированным акциям. По ранее действовавшей дивидендной политике ПАО ""Татнефть"" сумма средств, направляемых на выплату дивидендов, должна была составлять не менее 30% от чистой прибыли компании, определенной по российским стандартам бухгалтерского учета (РСБУ). Но уже по итогам 2016 года было решено направить 50% консолидированной чистой прибыли по международным стандартам финансовой отчетности (МСФО), то есть от консолидированного результата ""Татнефти"" и ее дочерних обществ. В качестве дивидендов было выплачено 54,7 млрд рублей или 22,81 рубля на акцию. Дивидендная доходность на день закрытия реестра составила 5,87% по обыкновенным и 7,92% по привилегированным акциям. Кроме этого, в конце прошлого года ""Татнефть"" приняла решение выплатить промежуточные дивиденды по итогам 9 месяцев 2017 года в размере 27,78 рублей на одну акцию, что в совокупности составляет 75% от чистой прибыли ПАО ""Татнефть"" по РСБУ за указанный период. Промежуточная консолидированная отчетность ""Татнефти"" по МСФО за 9 месяцев 2017 года продемонстрировала рост показателей. Консолидированная выручка выросла к предыдущему году на 17,8%, до 415,24 млрд рублей. Показатель EBITDA увеличился на 14,8% - до 115,15 млрд рублей. Рентабельность по EBITDA составила 27%. Чистая прибыль за девять месяцев 2017 года выросла на 18,1%, составив 88,80 млрд рублей по сравнению с 75,21 млрд рублей за соответствующий период 2016 года.  ""С учетом произошедших изменений мы пересмотрели нашу оценку компании в сторону повышения. Наша итоговая прогнозная стоимость ПАО ""Татнефть"" им. В. Д. Шашина составляет $19 167 млн, целевая цена находится на уровне $8,39 (485,0 рублей) по обыкновенным и $6,02 (347,8 рублей) по привилегированным акциям. Потенциал снижения к текущим ценам составляет 13,7%, в связи с чем мы изменяем рекомендацию с “продавать” на “держать”"", - говорит ведущий аналитик ГК ""ФИНАМ"" Алексей Калачев."
295,08.02.2018,"Группа ""Татнефть"" в январе сократила добычу на 2,3%",https://www.finam.ru/analysis/newsitem/gruppa-tatneft-v-yanvare-sokratila-dobychu-na-2-3-20180208-10257/,tatneft-3,10:25,08.02.2018,"Предприятиями группы ""Татнефть"" в январе добыто 2 445 тыс. тонн нефти (97,7% к январю 2017 года), в том числе компанией ""Татнефть"" - 2 416 тыс. т (97,7% к январю 2017 года). Добыча сверхвязкой нефти составила 156,4 тыс. тонн, сообщила компания. На лицензионных участках за пределами Татарстана ООО ""Татнефть-Самара"" добыто 29 тыс. т (92,9% к январю 2017г.). За январь 2018 года по новому бурению построена и сдана 51 скважина (2017г. – 59 скв.), в том числе эксплуатационное бурение – 35 скв., бурение на битум – 16 скв. За январь 2018 года в бурении боковых стволов (БС) и боковых горизонтальных стволов (БГС) сдано 2 скважины. На сегодняшний день в Самарской области ведется бурение скважины №278 для ООО ""Татнефть-Самара"". За январь 2018 года бригадами текущего и капитального ремонта скважин и ПНП на объектах ""Татнефти"" произведен текущий ремонт на 798 скважинах, выполнен капитальный ремонт 193 скважин. Гидроразрыв пласта произведен на 69 скважинах. На 175 скважинах произведены работы по повышению нефтеотдачи пластов, в том числе химическими методами обработаны 82 скважины. За пределами Татарстана отремонтировано 8 скважин. В январе 2018 года комплексом нефтеперерабатывающих и нефтехимических заводов ""ТАНЕКО"" переработано 795,9 тыс. т сырья в том числе в январе переработано 734,2 тыс. т нефтесырья. В январе 2018 года произведено 752,6 тыс. т нефтепродуктов."
296,05.02.2018,"Вес бумаг ""Татнефти"" в индексе MSCI был снижен до 9,03%",https://www.finam.ru/analysis/newsitem/ves-bumag-tatnefti-v-indekse-msci-byl-snizhen-do-9-03-20180205-122929/,tatneft-3,12:29,05.02.2018,"На прошедших выходных MSCI провела ребалансировку индекса MSCI Russia 10/40. Как отмечается в обзоре Ильи Питерского, стратега ""ВТБ Капитала"", ребалансировка стала следствием опережающей динамики котировок ""Татнефти"" (+25% с начала года, тогда как индекс РТС +10%). В результате вес бумаг ""Татнефти"" в индексе был снижен на 103 бп, до 9,03%. Помимо этого, был снижен вес бумаг MTС (–43 бп, до 4,51%), ""НОВАТЭКа"" LI (–47 бп, до 4,51%) и ""АЛРОСА"" (–28 бп, до 4,51%). Веса следующих компаний в индексе были повышены: ""ЛУКОЙЛ"" (+33 бп, до 9,03%), НЛМК (+25 бп, до 4,51%), ""Северсталь"" и ""Мосбиржа"" (оба +27 бп, до 4,51%), ""Магнит"" (+24% бп, до 3,42%), ""Полюс"" (+23 бп, до 3,22%), ""Интер РАО"" (+23 бп, до 3,20%), ""ФосАгро"" (+19 бп, до 2,75%), ММК (+19 бп, до 2,68%) и ""РусГидро"" (+15 бп, до 2,07%). ""Мы не обладаем информацией относительно пассивных инвестиций в соответствии с этим индексом. Тем не менее, позиции активно-управляемых европейских фондов, инвестирующих в Россию и использующих этот индекс в качестве бенчмарка, в акциях компаний, чей вес был понижен, могут оказаться слишком значительными, и наоборот"", - отметил Илья Питерский."
297,30.01.2018,"""Татнефть"" изменила дивидендную политику",https://www.finam.ru/analysis/newsitem/tatneft-izmenila-dividendnuyu-politiku-20180130-145144/,tatneft-3,14:51,30.01.2018,"Совет директоров ""Татнефти"" утвердил изменения в положение о дивидендной политике, сообщила компания. При определении дивидендов, рекомендуемых для утверждения общим собранием акционеров, совет директоров будет исходить из того, что свободные денежные средства, которые формируются после финансирования инвестиционной программы, исполнения обязательств и иных потребностей общества, могут быть распределены в виде дивидендов. Целевым уровнем средств, направляемых на выплату дивидендов, является не менее 50% от чистой прибыли, определенной по РСБУ или МСФО, в зависимости от того, какая из них является большей. Как и ранее, помимо годовых дивидендов, совет директоров может предложить утвердить промежуточные дивиденды по итогам первого квартала, полугодия и девяти месяцев."
298,30.01.2018,"Moody's повысило кредитный рейтинг ""Татнефти""",https://www.finam.ru/analysis/newsitem/moody-s-povysilo-kreditnyiy-reiyting-tatnefti-20180130-090945/,tatneft-3,09:09,30.01.2018,"Международное кредитное рейтинговое агентство Moody's объявило о повышении кредитного рейтинга ""Татнефти"" до ""Baa3"" c ""позитивным"" прогнозом, говорится в сообщении российской компании. Решение Moody's связано с изменением прогноза по кредитному рейтингу Российской Федерации и повышением ""странового потолка"" с ""Ba1"" до ""Baa3"". Кредитный рейтинг ""Baa3"" относится к инвестиционному уровню и отражает высокое кредитное качество компании."
299,29.01.2018,События предстоящего дня: Путин посетит Национальный центр управления обороной,https://www.finam.ru/analysis/newsitem/sobytiya-predstoyashego-dnya-putin-posetit-nacionalnyiy-centr-upravleniya-oboronoiy-20180129-210041/,tatneft-3,21:00,29.01.2018,"Во вторник, 30 января, Владимир Путин посетит Национальный центр управления обороной. В работе конференции примут участие руководители федеральных министерств и ведомств, руководящий состав Минобороны РФ, представители госкорпораций и предприятий оборонно-промышленного комплекса, которые обсудят вопросы применения вооружения, военной и специальной техники в Сирии. Пройдет заседание совета директоров ""Татнефти"". Совет директоров обсудит проведение годового общего собрания акционеров по итогам 2017 года, а также новую редакцию положения о дивидендной политике. Состоится заседание совета директоров ДВМП. Совет директоров рассмотрит вопрос об увеличении уставного капитала ПАО ""ДВМП"" путем размещения дополнительных акций. В ходе заседания совета директоров ""ФосАгро"" будут рассмотрены предложения акционеров о выдвижении кандидатов в совет директоров, а также утвердит форму и текст бюллетеней для голосования по вопросам повестки дня внеочередного общего собрания акционеров. Совет директоров ""ГАЗа"" даст согласие на совершение дочерним обществом - ООО ""Ликинский автобус"" крупной сделки. В повестке заседания совета директоров ""МегаФона"" значатся вопросы об избрании председателя совета директоров, членов аудиторского комитета и комитетов по финансам и по вознаграждениям."
300,22.01.2018,Новак ждет ликвидации излишков нефти на мировом рынке до конца 2018 года,https://www.finam.ru/analysis/newsitem/novak-zhdet-likvidacii-izlishkov-nefti-na-mirovom-rynke-do-konca-2018-goda-20180122-141242/,tatneft-3,14:12,22.01.2018,"До конца 2018 года излишки нефти на мировом рынке будут ликвидированы, ожидает министр энергетики Александр Новак. Об этом он рассказал в интервью телеканалу ""Россия 24"". ""Соглашение ОПЕК+ в 2017 году достигло своей цели, идет ребалансировка рынка нефти, где-то около 2/3 излишка нефти сняты с рынка, в 2017 году цена на нефть была примерно на 30% выше, чем в 2016-ом; мы увидели в 2017 году оживление инвестиций в отрасль, получено дополнительно 6% инвестиций. То есть эти показатели говорят, что рынок позитивно реагирует на совместные действия. Окончательных результатов мы еще не достигли, на рынке еще около 120 млн баррелей нефти излишков. Мы продолжаем совместно действовать, как вы знаете, соглашение будет действовать до конца 2018 года. Следующее заседание Комитета по мониторингу будет в апреле в Эр-Рияде, а министерская встреча состоится в июне в Вене"", - сказал Новак. ""Большинство стран выполняют или перевыполняют обязательства соглашения. Например, Саудовская Аравия или Венесуэла. Но есть страны, которые пока не вышли на целевые показатели, например, Ирак, ОАЭ. Но в последние месяцы мы видим позитивную динамику"", - рассказал Александр Новак. ""Условия и возможные механизма выхода из сделки обсуждаются. Есть понимание, что по окончании балансировки рынка резкий выход не нужен, он может стать дестабилизирующим фактором. Пока обсуждения не дошли до формализации"", - сказал министр. ""Сегодня мы видим, что значительная часть пути по балансировке рынка пройдена. Надеюсь, до конца года мы выйдем на баланс спроса и предложения, все излишки с рынка будут ликвидированы. Вместе с тем, совместная работа нефтеэкспортеров на этом не закончится"", - сказал Новак. О сокращении добычи нефти 13 стран ОПЕК договорились в Вене 30 ноября 2016 года. К соглашению присоединились еще 11 стран, не входящих в ОПЕК, в том числе Россия. Стоит отметить, что эксперты уверены в продлении соглашения ОПЕК+ в 2018 году."
301,11.01.2018,"""Татнефть"" в 2017 году увеличила добычу на 0,9%",https://www.finam.ru/analysis/newsitem/tatneft-v-2017-godu-uvelichila-dobychu-na-0-9-20180111-11106/,tatneft-3,11:10,11.01.2018,"За 12 месяцев 2017 года предприятиями группы ""Татнефть"" добыто 28,939 млн тонн нефти, что на 0,9% больше, чем в 2016 году. В том числе ПАО ""Татнефть"" - 28,586 млн тонн (+0,9%), на лицензионных участках за пределами РТ - 353 тыс. т (-0,2%). Об этом говорится в сообщении компании. В декабре 2017 года предприятиями группы ""Татнефть"" добыто 2,445 млн тонн нефти (-6% к декабрю 2016 г.), в том числе ПАО ""Татнефть"" - 2,416 млн тонн (-6%), ООО ""Татнефть-Самара"" на лицензионных участках за пределами РТ – 29,357 млн тонн (-7,4%). За двенадцать месяцев 2017 года в новом бурению построено и сдано 762 скважины, что на 14% больше, чем в 2016 г. (2016 г. – 667 скв.), в том числе -эксплуатационное бурение – 702 скв., из них 493 скв. - по уплотняющей сетке; разведочное бурение – 10 скв., бурение на битум – 50 скв. План по сдаче эксплуатационных скважин выполнен по всем НГДУ - при плане  697 сдано  702 скважины, выполнение годового плана составило 101%. За пределами Татарстана в 2017 году велось бурение в Самарской, Ульяновской, Оренбургской областях и в Республике Калмыкия. Пробурено и сдано 12 скважин, из них 9 скважин - в Самарской области для ООО ""Татнефть-Самара""; 2 скважины - в Ульяновской области для НГДУ ""Ямашнефть""; 1 скважина в Оренбургской области - для ООО ""Татнефть-Северный"". В Республике Калмыкия освоение скважины №1 Барьерной площади завершено, скважина находится в консервации."
