,preview_date,preview_text,url,company,article_time,article_date,article_text
451,01.06.2015,"Fitch подтвердило рейтинг ""Связьинвестнефтехима"" на уровне ""BBB-"" с ""негативным"" прогнозом",https://www.finam.ru/analysis/newsitem/fitch-podtverdilo-reiyting-svyazinvestneftexima-na-urovne-bbb-s-negativnym-prognozom-20150601-134842/,tatneft-3,13:48,01.06.2015,"Fitch Ratings подтвердило долгосрочный рейтинг дефолта эмитента ОАО ""Связьинвестнефтехим"" в иностранной и национальной валюте на уровне ""BBB-"", говорится в сообщении агентства. Краткосрочный рейтинг подтвержден на уровне ""F3"". Прогноз по долгосрочному рейтингу - ""негативный""."
452,22.05.2015,"""Райффайзенбанк"" приобрел 6,09% голосующих акций ""Татнефти""",https://www.finam.ru/analysis/newsitem/raiyffaiyzen-bank-priobrel-6-09-golosuyushix-akciiy-tatnefti-20150522-20157/,tatneft-3,20:15,22.05.2015,"""Райффайзенбанк"" приобрел 6,09% голосующих акций ОАО ""Татнефть"", говорится в сообщении нефтяной компании. Сделка состоялась 8 мая 2015 года, ранее банк не имел доли в ""Татнефти""."
453,08.05.2015,"""Татнефть"" увеличила добычу нефти за четыре месяца 2015 года на 0,7% - до 8,7 млн тонн",https://www.finam.ru/analysis/newsitem/tatneft-uvelichila-dobychu-nefti-za-chetyre-mesyaca-2015-goda-na-0-7-do-8-7-mln-tonn-20150508-12182/,tatneft-3,12:18,08.05.2015,"ОАО ""Татнефть"" в апреле 2015 года добыло 2,173 млн т нефти - 101,0% к апрелю 2014 года (+21 190 т), за четыре месяца - 8,669 млн т, что на 63 763 т больше, чем в 2014 году (100,7%). Об этом говорится в сообщении компании. За четыре месяца 2015 г. проходка по новому бурению составила 180,5 тыс. м (2014 г. - 142,7 тыс.м). Из них для ОАО ""Татнефть"" - 157,6 тыс. м (2014 г. - 118,2 тыс. м), в том числе бурение на битум - 3,9 тыс. м; эксплуатационное бурение - 146,5 тыс. м; разведочное бурение - 7,2 тыс. м. За четыре месяца 2015 г. проходка по бурению боковых стволов (БС) и бурению горизонтальных стволов (БГС) составила 14,4 тыс. м (2014 г. - 17,6 тыс. м). Из них для ОАО ""Татнефть"" - 8,5 тыс. м (2014 г. - 6,5 тыс. м). Сдано заказчикам 28 скв. (2014 г. - 32 скв.), в том числе для ОАО ""Татнефть"" - 18 скв. (2014 г. - 23 скв.). В апреле 2015 года комплексом нефтеперерабатывающих и нефтехимических заводов ""ТАНЕКО"" переработано 764,8 тыс. т сырья, с начала года - 2 967, 4 тыс. т, в том числе 714,0 тыс. т нефтесырья, с начала года - 2846,1 тыс.т., произведено 735,5 тыс. т нефтепродуктов, с начала года - 2 841,8."
454,07.05.2015,"События предстоящего дня: ""Магнит"" опубликует неаудированные результаты деятельности за апрель 2015 года",https://www.finam.ru/analysis/newsitem/sobytiya-predstoyashego-dnya-magnit-opublikuet-neaudirovannye-rezultaty-deyatelnosti-za-aprel-2015-goda-20150507-210930/,tatneft-3,21:09,07.05.2015,"8 мая, в пятницу, ""Магнит"" опубликует неаудированные результаты деятельности за апрель 2015 года. Выручка ""Магнита"" в апреле 2014 года увеличилась на 30,5% в рублях и составила 59 724,6 млн рублей. Состоятся закрытия реестров акционеров ""Татнефти"", ВТБ, ЧЦЗ, ""МРСК Урала"" и ""МРСК Центра и Приволжья"" для участия в ГОСА. Годовые общие собрания акционеров компаний назначены на 26, 25, 24, 17 и 16 июня 2015 года соответственно."
455,29.04.2015,ЦБ установил факт манипулирования рядом акций в период с 2012 по 2013 год,https://www.finam.ru/analysis/newsitem/cb-ustanovil-fakt-manipulirovaniya-ryadom-akciiy-v-period-s-2012-po-2013-gody-20150429-192056/,tatneft-3,19:20,29.04.2015,"Банк России установил факт манипулирования рынками обыкновенных акций ОАО ""НК ""Роснефть"", ОАО ""РусГидро"", ОАО ""Сургутнефтегаз"", ОАО ""Татнефть"", ОАО ""НК ""ЛУКОЙЛ"", обыкновенных и привилегированных акций ОАО ""Ростелеком"" и ОАО ""Сбербанк России"" на торгах ЗАО ""ФБ ММВБ"" в период с 1 февраля 2012 года по 1 октября 2013 года. Об этом говорится в сообщении регулятора. В ходе проверки Банк России установил факты, свидетельствующие о предварительной договоренности между ООО ""Урса Капитал"", ООО КБ ""Транспортный"", ""ИНРЕСБАНК"" ООО в собственных интересах, клиентами ""ИНРЕСБАНК"" ООО: АКБ МОСОБЛБАНК ОАО, ООО ""РИК"", ООО ""РСД"", ООО КБ ""Финанс Бизнес Банк"", — а также клиентом другого профессионального участника Шепелевым Е. Л. о совершении сделок с акциями, что привело к существенным отклонениям объема торгов, спроса и предложения акций. В отдельные дни доля договорных сделок между вышеуказанными организациями составляла 20-67% объема торгов акциями. Таким образом, результатом манипулирования стало создание искусственных уровней спроса, предложения и объема таких торгов. Указанные действия являются грубым нарушением норм законодательства Российской Федерации. Как отмечает ЦБ, манипулирование рынками Акций осуществлялось ""ИНРЕСБАНК"" ООО, АКБ МОСОБЛБАНК ОАО и ООО КБ ""Финанс Бизнес Банк"" в период до принятия Банком России решения об их финансовом оздоровлении. Прежние мажоритарные акционеры данных организаций выведены из состава собственников и органов управления этих банков. Учитывая изложенное, Банк России не будет принимать меры административного характера в отношении вышеперечисленных кредитных организаций. При этом у должностных лиц, непосредственно осуществлявших манипулирование рынками акций, Банк России аннулировал квалификационные аттестаты специалистов финансового рынка. Данные должностные лица освобождены от занимаемых должностей в указанных кредитных организациях. У иных юридических лиц — профессиональных участников рынка ценных бумаг, манипулировавших рынками акций, Банк России аннулировал лицензии на осуществление профессиональной деятельности на рынке ценных бумаг. Банк России также направил лицам, манипулировавшим рынками акций, предписания о недопущении аналогичных нарушений в дальнейшем."
456,28.04.2015,"Чистая прибыль ""Татнефти"" по РСБУ за 1 квартал 2015 года снизилась на 15% - до 20,7 млрд рублей",https://www.finam.ru/analysis/newsitem/chistaya-pribyl-tatnefti-po-rsbu-za-1-kvartal-2015-goda-snizilas-na-15-do-20-7-mlrd-rubleiy-20150428-172645/,tatneft-3,17:26,28.04.2015,"Чистая прибыль ОАО ""Татнефть"" по РСБУ за 1 квартал 2015 года снизилась на 14,7% и составила 20,76 млрд рублей, следует из отчета компании. Выручка за отчетный период составила 115,57 млрд рублей, что на 16,7% больше, чем годом ранее."
457,27.04.2015,"""Татнефть"" может выплатить дивиденды по итогам 2014 года в размере 10,58 рубля на акцию",https://www.finam.ru/analysis/newsitem/tatneft-mozhet-vyplatit-dividendy-po-itogam-2014-goda-v-razmere-10-58-rublya-na-akciyu-20150427-182048/,tatneft-3,18:20,27.04.2015,"Совет директоров ОАО ""Татнефть"" рекомендовал годовому общему собранию акционеров компании выплатить дивиденды по итогам 2014 года в размере 1058% к номинальной стоимости обыкновенных и привилегированных акций. Номинальная стоимость акций ""Татнефти"" составляет 1 рубль. Таким образом, на каждую акцию может быть выплачено 10,58 рубля. Реестр акционеров на получение дивидендов предлагается закрыть 15 июля."
458,24.04.2015,"События предстоящих дней: ""О’Кей"" отчитается за 1 квартал, закроется реестр акционеров ""Ростелекома"" для участия в ГОСА",https://www.finam.ru/analysis/newsitem/sobytiya-predstoyashix-dneiy-o-keiy-otchitaetsya-za-1-kvartal-zakroetsya-reestr-akcionerov-rostelekoma-dlya-uchastiya-v-gosa-20150424-210611/,tatneft-3,21:06,24.04.2015,"26 апреля, в воскресенье, состоится закрытие реестра акционеров ""ДИКСИ"" для участия в ВОСА, которое пройдет 11 июня. В повестке дня собрания значатся вопросы о выплате вознаграждения членам совета директоров общества, об одобрении крупной сделки, в совершении которой имеется заинтересованность и др. 27 апреля, в понедельник, пройдет внеочередное общее собрание акционеров ""Аптечной сети 36,6"". Участники рассмотрят две сделки с заинтересованностью - о заключении договора поручительства с ""Московским кредитным банком"" и с банком ""ФК ""Открытие"". Закрытие реестра акционеров для участия в ВОСА прошло 13 марта.  ""О'Кей""  опубликует отчетность по МСФО за 1 квартал 2015 года. Чистый убыток ""О'Кей"" за 1 квартал 2014 года по МСФО составил 22,2 млн рублей против прибыли в размере 144,5 млн рублей по итогам 1 квартала 2013 года.  Пройдет заседание совета директоров ""Татнефти"", где будут рассмотрены вопросы, связанные с предстоящим годовым общим собранием акционеров ""Татнефти"", в частности, вопрос о размере дивидендов за 2014 год. Закроется реестр акционеров ""Ростелекома"" для участия в ГОСА, которое состоится 15 июня. Также состоится закрытие реестра акционеров ТД ""ГУМ"" для участия в ГОСА, которое намечено на 11 июня."
459,17.04.2015,"""Нижнекамскнефтехим"" подал иск к ""Татнефть-Нефтехимснаб"" о взыскании 96 млн рублей",https://www.finam.ru/analysis/newsitem/nizhnekamskneftexim-podal-isk-k-tatneft-nefteximsnab-o-vzyskanii-96-mln-rubleiy-20150417-154541/,tatneft-3,15:45,17.04.2015,"""Нижнекамскнефтехим"" подал в Арбитражный суд Татарстана исковое заявление о взыскании 96,011 млн рублей с ""Татнефть-Нефтехимснаб"". Об этом говорится в картотеке суда. Иск подан 14 апреля 2014 года, причина искового требования не раскрывается."
460,16.04.2015,"Moody's подтвердило рейтинги ""Татнефти"", ""Нижнекамскнефтехима"" и ""Связьинвестнефтехима""",https://www.finam.ru/analysis/newsitem/moody-s-podtverdilo-reiytingi-tatnefti-nizhnekamskneftexima-i-svyazinvestneftexima-20150416-153845/,tatneft-3,15:38,16.04.2015,"Moody's Investors Service подтвердило корпоративный рейтинг ""Связьинвестнефтехима"" на уровне ""Ba2"" и рейтинг вероятности дефолта на уровне ""Ba2-PD"", говорится в сообщении агентства. Рейтинги подтверждены с ""негативным"" прогнозом. Одновременное Moody's подтвердило рейтинг ""Татнефти"" на уровне ""Ba1"" и рейтинг вероятности дефолта компании на уровне ""Ba1-PD"". Прогноз по рейтингам - ""негативный"". Кроме того, рейтинговое агентство подтвердило рейтинг ""Нижнекамскнефтехима"" на уровне ""Ba3"", а рейтинг вероятности дефолта на уровне ""Ba3-PD"" со ""стабильными"" прогнозами."
461,06.04.2015,"""Татнефть"" в 1 квартале 2015 года нарастила добычу нефти на 0,7% - до 6,5 млн тонн",https://www.finam.ru/analysis/newsitem/tatneft-v-1-kvartale-2015-goda-narastila-dobychu-nefti-na-0-7-do-6-5-mln-tonn-20150406-175040/,tatneft-3,17:50,06.04.2015,"""Татнефть"" в 1 квартале 2015 года добыла 6,495 млн тонн нефти, что на 0,7% превышает результат аналогичного периода прошлого года, сообщила компания. В том числе в марте компания нарастила добычу на 0,9% - до 2,242 млн тонн. В 1 квартале проходка по новому бурению составила 130,6 тыс. метров (рост на 22,6%), в том числе для АО ""Татнефть"" - 108,8 тыс. метров (рост на 26,8%), из них на битум - 2,1 тыс. метров, эксплуатационное бурение - 100,2 тыс. метров, разведочное бурение - 6,5 тыс. метров. Согласно материалам ""Татнефти"", за три месяца 2015 года на предприятиях компании было переработано 2,132 млн тонн нефтесырья и произведено 2,112 млн тонн нефтепродуктов, что на 4% и 3,8% больше, чем в 1 квартале 2014 года."
462,02.04.2015,"Капвложения ""Татнефти"" в 2015 году ожидаются на уровне 70-75 млрд рублей",https://www.finam.ru/analysis/newsitem/kapvlozheniya-tatnefti-v-2015-godu-ozhidayutsya-na-urovne-70-75-mlrd-rubleiy-20150402-165627/,tatneft-3,16:56,02.04.2015,"Капитальные вложения ""Татнефти"" в 2015 году ожидаются на уровне 70-75 млрд рублей. Об этом в ходе телефонной конференции в четверг сообщил помощник гендиректора компании Василий Мозговой. 25 млрд рублей планирует направить на добычу традиционной нефти, 25 млрд рублей - на программу добычи сверхвязкой нефти и аналогичную сумму - в переработку нефти. "
463,01.04.2015,"Чистая прибыль ""Татнефти"" по МСФО за 2014 год выросла на 30% - до 92,2 млрд рублей",https://www.finam.ru/analysis/newsitem/chistaya-pribyl-tatnefti-po-msfo-za-2014-god-vyrosla-na-30-do-92-2-mlrd-rubleiy-20150401-173457/,tatneft-3,17:34,01.04.2015,"Чистая прибыль ""Татнефти"" по МСФО за 2014 год выросла на 25% и составила 97,67 млрд рублей против 78,34 млрд рублей годом ранее. Об этом говорится в отчетности компании. Прибыль, причитающаяся акционерам Группы, составила 92,2 млрд рублей против 70,8 млрд рублей в 2013 году, показав рост на 30,2%. Выручка подросла за 12 месяцев 2014 года на 4,7% и составила 476,36 млрд рублей. Прибыль до налога на прибыль выросла со 101,29 млрд рублей до 123,97 млрд рублей. Общий консолидированный акционерный капитал увеличился с 503,982 млрд рублей на 31 декабря 2013 года до 582,244 млрд рублей на 31 декабря 2014 года."
464,30.03.2015,"Чистая прибыль ""Татнефти"" по РСБУ за 2014 год выросла на 28,5% - до 82 млрд рублей",https://www.finam.ru/analysis/newsitem/chistaya-pribyl-tatnefti-po-rsbu-za-2014-god-vyrosla-na-28-5-do-82-mlrd-rubleiy-20150330-133429/,tatneft-3,13:34,30.03.2015,"Чистая прибыль ОАО ""Татнефть"" по РСБУ за 2014 год выросла на 28,5% и составила 82,061 млрд рублей по сравнению с 63,85 млрд рублей годом ранее. Об этом свидетельствуют данные из отчетности компании.  Выручка выросла на 7,88% с 363,531 млрд рублей до 392,357 млрд рублей. Валовая прибыль ""Татнефти"" за 12 месяцев упала на 11,7% и составила 119,18 млрд рублей. Прибыль до налогообложения за отчетный период выросла на 24,64% - до 104,058 млрд рублей."
465,25.03.2015,"События предстоящего дня: Свои финотчетности по МСФО за 2014 год опубликуют ""Сбербанк"", ""Башнефть"" и ""Мосэнерго""",https://www.finam.ru/analysis/newsitem/sobytiya-predstoyashego-dnya-sovi-finotchetnosti-po-msfo-opublikuyut-sberbank-bashneft-i-mosenergo-20150325-210041/,tatneft-3,21:00,25.03.2015,"Завтра, 26 марта состоится публикация финансовой отчетности ""Сбербанка"" по МСФО за 2014 год. Чистая прибыль ""Сбербанка"" за 2013 год по МСФО достигла 362 млрд рублей, увеличившись на 4,1% по сравнению с чистой прибылью за 2012 год в размере 347,9 млрд рублей. В четверг будет опубликована финансовая отчетность ""Башнефти"" по МСФО за 4 квартал и весь 2014 год. Чистая прибыль ""Башнефти"" по МСФО за 2013 год снизилась на 11,7% - до 46,2 млрд рублей. Кроме того, завтра представит свои финрезультаты по МСФО за 2014 года ""Мосэнерго"". Чистая прибыль ""Мосэнерго"" по МСФО за 12 месяцев 2013 года выросла на 18,5% год к году, до 7,48 млрд рублей. Показатель EBITDA увеличился на 17,8% по сравнению с аналогичным периодом предыдущего года и достиг 23,85 млрд рублей. В ходе заседания совета директоров Московской биржи состоится предварительное утверждение годового отчета компании за 2014 год, утверждение формы и текста бюллетеней для голосования на годовом собрании. Кроме того, будут рассмотрены рекомендации по вопросу утверждения годовой бухгалтерской отчетности, в том числе отчета о финансовых результатах за 2014 финансовый год. В повестке заседания директоров Банка ""Санкт-Петербург"" значатся вопросы об определении места и времени проведения годового собрания, даты составления списка лиц, имеющих право на участие в ГОСА, о дивидендной политике банка и о результатах деятельности компании по МСФО в 2014 году. Совет директоров ""Татнефти"" обсудит итоги исполнения бюджета ""Татнефти"" за два месяца 2015 года и утверждение бюджета на апрель и второй квартал 2015 года, а также ход выполнения мероприятий по импортозамещению."
466,24.03.2015,"В ""Татнефти"" назначены два новых заместителя генерального директора",https://www.finam.ru/analysis/newsitem/v-tatnefti-naznacheny-dva-novyx-zamestitelya-generalnogo-direktora-20150324-104210/,tatneft-3,10:42,24.03.2015,"Генеральный директор ""Татнефти"" Наиль Маганов назначил заместителем генерального директора компании по ремонту, бурению скважин и повышению нефтеотдачи пластов назначен Рината Шафигуллина, говорится в сообщении ""Татнефти"". Заместителем генерального директора - директором департамента в Казани назначен Дамир Мухаметшин. Шафигуллин ранее занимал должность директора ООО ""УК ""Татбурнефть"". Г-н Мухаметшин ранее был директором филиала Банковского центра Татарстан ПАО Банк ""ЗЕНИТ""."
