,preview_date,preview_text,url,company,article_time,article_date,article_text
144,28.11.2019,"События предстоящего дня: Путин посетит Кабардино-Балкарию, ""Газпром"" и ""Аэрофлот"" раскроют отчетности",https://www.finam.ru/analysis/newsitem/sobytiya-predstoyashego-dnya-putin-posetit-kabardino-balkariyu-gazprom-i-aeroflot-raskroyut-otchetnosti-20191128-21001/,tatneft-3,21:00,28.11.2019,"В пятницу, 29 ноября, президент России Владимир Путин совершит рабочую поездку в Кабардино-Балкарию. В Нальчике глава государства проведёт заседание Совета при президенте по межнациональным отношениям. Основной темой станет вопрос о реализации целей и задач Стратегии государственной национальной политики Российской Федерации. Докладчиками выступят министр культуры Владимир Мединский и министр просвещения Ольга Васильева. Корпоративный календарь также насыщен событиями. ""Газпром"" опубликует финансовую отчетность по МСФО за 9 месяцев 2019 года. За 9 месяцев 2018 года величина прибыли по МСФО, относящейся к акционерам ""Газпрома"", составила 1,017 трлн рублей. Финансовые результаты раскроет и ""Аэрофлот"". Прибыль ""Аэрофлота"" за 3 квартал 2018 года увеличилась до 27,718 млрд рублей. ""Татнефть"" также запланировала публикацию финансовой отчетности за 3 квартал и 9 месяцев 2019 года. За 9 месяцев 2018 года показатель EBITDA вырос на 79,8% год-к-году - до 237,674 млрд рублей, за 3 квартал показатель вырос в 2,3 раза - до 94,428 млрд рублей. Совет директоров ""Роснефти"" на заседании определит позицию компании в отношении реализации обществом ""СевКомНефтегаз"" бизнес-проекта ""Развитие Северо-Комсомольского месторождения. Пласт ПК1"". Акционеры ""Акрона"" на внеочередном общем собрании одобрят новый устав компании, а также примут решение по дивидендам за 9 месяцев. Закрытие реестра - 5 ноября 2019 года. ""Магнит"" закроет реестр акционеров для участия в ВОСА. Совет директоров ""Магнита"" рекомендовал внеочередному общему собранию акционеров выплатить дивиденды по итогам 9 месяцев 2019 года в размере 147,19 рубля на акцию. ВОСА пройдет 24 декабря. 29 ноября - последний день, когда акции ""Северстали"" торгуются с дивидендами. Дата закрытия реестра акционеров для получения дивидендов - 3 декабря. Внимание стоит обратить и на комментарий Банка России ""Экономика"", который будет опубликован в пятницу. Материал подготовлен департаментом денежно-кредитной политики. Обзор публикуется ежемесячно с 2016 года."
145,28.11.2019,"""Татнефть"" повысила прогноз добычи в 2020 году до 29,5 млн тонн",https://www.finam.ru/analysis/newsitem/tatneft-povysila-prognoz-dobychi-v-2020-godu-do-29-5-mln-tonn-20191128-112125/,tatneft-3,11:21,28.11.2019,"Совет директоров ""Татнефти"" обсудил прогнозные показатели деятельности бизнес-направления ""Разведка и Добыча"" на 2020 год, сообщила компания. В базовом сценарии блок ""РиД"" компании планирует обеспечить в следующем году объем добычи на уровне 29,5 млн тонн, продолжая реализацию стратегического проекта ""СВН-3200"". Сформирован также дополнительный сценарий увеличения добычи в случае отмены ограничений в рамках соглашения ""ОПЕК+"". 24 октября 2019 года совет директоров ""Татнефти"" утвердил основные параметры и условия формирования финансово-хозяйственной деятельности на 2020 год. В ""базовом варианте"" добыча нефти планировалась в объемах 29,2 млн тонн."
146,27.11.2019,События предстоящего дня: Путин посетит Киргизию,https://www.finam.ru/analysis/newsitem/sobytiya-predstoyashego-dnya-putin-posetit-kirgiziyu-20191127-210019/,tatneft-3,21:00,27.11.2019,"28 ноября, в четверг, президент России Владимир Путин примет участие в саммите Организации Договора о коллективной безопасности (ОДКБ) в Киргизии. Планируется рассмотреть ключевые темы союзнического взаимодействия в рамках ОДКБ, а также обменяться мнениями по актуальным региональным и международным проблемам. В ходе заседания Владимир Путин обозначит приоритеты российского председательства в ОДКБ в 2020 году. Из корпоративных событий отметим заседания советов директоров ""Газпрома"", ""ТрансКонтейнера"", ""Татнефти"". Совет директоров ""Газпрома"" оценит влияние ""большого налогового маневра"" 2019-2024 годов в отношении добычных и перерабатывающих активов группы ""Газпром"". Совет директоров ""ТрансКонтейнера"" утвердит корректировки инвестиционной программы на 2019 год, а также рассмотрит бюджет на 2020 год. Совет директоров ""Татнефти"" рассмотрит вопрос о составе правления, изучит прогнозные показатели бизнес-направления ""Разведка и Добыча"" на 2020 год, утвердит бюджет на 2020 год."
147,27.11.2019,"""Татнефть"" получит 51% производителя шин в Узбекистане",https://www.finam.ru/analysis/newsitem/tatneft-poluchit-51-proizvoditelya-shin-v-uzbekistane-20191127-093417/,tatneft-3,09:34,27.11.2019,"""Татнефть"" подписало с ""Узкимёсаноат"" и ООО ""Биринчи резинотехника заводи"" (Узбекистан) соглашение о создании совместного предприятия. Об этом сообщила российская компания. В создаваемом на базе БРЗ совместном предприятии доля ""Татнефти"" составит 51%, ""Узкимёсаноат"" - 49%. Завершение сделки (создание совместного предприятия) произойдет после исполнения сторонами ряда отлагательных условий. Ожидается, что сделка будет завершена в течение нескольких последующих месяцев. БРЗ был основан в 2014 году постановлением президента Республики Узбекистан ""О мерах по организации строительства завода резинотехнических изделий на территории свободной индустриальной зоны ""Ангрен"" в Республике Узбекистан""."
148,22.11.2019,"События предстоящих дней: Путин примет участие в съезде ""Единой России"", ""ФосАгро"" отчитается по МСФО",https://www.finam.ru/analysis/newsitem/sobytiya-predstoyashix-dneiy-putin-primet-uchastie-v-s-ezde-edinoiy-rossii-fosagro-otchitaetsya-po-msfo-20191122-210038/,tatneft-3,21:00,22.11.2019,"В субботу, 23 ноября, президент России Владимир Путин примет участие в пленарном заседании съезда партии ""Единая Россия"". Повестка заседания будет посвящена приоритетным задачам партии на ближайший период, внесению корректив в устав, а также изменениям в составе высшего совета и президиума генерального совета ""Единой России"". В воскресенье, 24 ноября, ""Татнефть"" закроет реестр акционеров для участия в ВОСА, которое пройдет 19 декабря 2019 года. В понедельник, 25 ноября, МТС представят новую стратегию развития до 2023 года, которая подразумевает ускоренное создание масштабной экосистемы новых цифровых продуктов для клиентов компании. 
Как создать оптимальный инвестиционный портфель?
 
  Ответьте всего на 10 вопросов и получите лучшее инвестиционное решение.
  
 НЛМК в понедельник закроет реестр акционеров для участия в ВОСА, которое пройдет 20 декабря. Акционеры на собрании примут решение о выплате промежуточных дивидендов. ""Ростелеком"" также закроет реестр акционеров для участия в ВОСА 18 декабря. Акционеры компании проголосуют за увеличение уставного капитала ""Ростелекома"" путем размещения по закрытой подписке 1,2 млрд обыкновенных акций. ""ФосАгро"" 25 ноября опубликует отчетность по МСФО за 3 квартал 2019 года. Чистая прибыль компании за 3 квартал 2018 года по МСФО более чем удвоилась, составив 12,9 млрд рублей ($197 млн). Советы директоров ""МРСК Центра"" и ""МРСК Центра и Приволжья"" в понедельник рассмотрят вопрос о созыве ВОСА своих компаний, а также рекомендации по выплате промежуточных дивидендов за 2019 год. "
149,14.11.2019,"""Татнефть"" может выплатить дивиденды за 3 квартал в размере 24,36 рубля на акцию",https://www.finam.ru/analysis/newsitem/tatneft-mozhet-vyplatit-dividendy-za-3-kvartal-v-razmere-24-36-rublya-na-akciyu-20191114-092653/,tatneft-3,09:26,14.11.2019,"Совет директоров ""Татнефти"" инициировал созыв внеочередного общего собрания акционеров и рекомендовал акционерам утвердить дивиденды по результатам 9 месяцев 2019 года в размере 64,47 руб. на одну привилегированную и обыкновенную акцию (6447% от номинальной стоимости акций), что в совокупности составляет около 100% от чистой прибыли ПАО ""Татнефть"" по РСБУ за указанный период (150 млрд рублей). Об этом сообщила компания. При утверждении внеочередным собранием акционеров, c учетом дивидендов, которые были выплачены по итогам 6 месяцев 2019 года в размере 40,11 руб. на каждую акцию, доплата по итогам 9 месяцев составит 24,36 рублей на акцию. Закрытие дивидендного реестра, предварительно, 30 декабря 2019 года. Внеочередное общее собрание акционеров пройдет 19 декабря 2019 года. Закрытие реестра для участия в ВОСА - 24 ноября 2019 года."
150,12.11.2019,"События предстоящего дня: пройдут заседания советов директоров ""Ростелекома"" и ""Татнефти""",https://www.finam.ru/analysis/newsitem/sobytiya-predstoyashego-dnya-proiydut-zasedaniya-sovetov-direktorov-rostelekoma-i-tatnefti-20191112-21002/,tatneft-3,21:00,12.11.2019,"13 ноября, в среду, президент РФ Владимир Путин посетит Бразилию для участия в саммите БРИКС. Лидеры Бразилии, России, Индии, Китая и ЮАР рассмотрят состояние и перспективы взаимодействия в рамках объединения, в том числе вопросы экономического, финансового и культурно-гуманитарного сотрудничества. Будут обсуждены также актуальные международные темы, ситуация в области контроля над вооружениями и проблематика совместного противодействия терроризму. Программой саммита предусмотрено участие лидеров стран ""пятёрки"" в Деловом форуме БРИКС, встреча с Деловым советом БРИКС и руководством Нового банка развития. Запланировано проведение двусторонних бесед Владимира Путина с участвующими в саммите главами государств и правительств. Совет директоров ""Ростелекома"" одобрит изменение доли участия компании в ООО ""Т2 РТК Холдинг"" (Tele2), а также утвердит повестку дня внеочередного общего собрания акционеров ""Ростелекома"". В повестке заседания советов директоров ""Татнефти"" и ""ТНС энерго"" - созыв внеочередного общего собрания акционеров. Совет директоров ММК рассмотрит изменения в положение о дивидендной политике. ОГК-2 опубликует финансовую отчетность по МСФО за 3 квартал 2019 года. В 3 квартале 2018 года прибыль ОГК-2 составила 7,65 млрд рублей."
151,08.11.2019,Ноябрьский пересмотр индекса MSCI Russia изменений не принес,https://www.finam.ru/analysis/newsitem/noyabrskiiy-peresmotr-indeksa-msci-russia-izmeneniiy-ne-prines-20191108-114144/,tatneft-3,11:41,08.11.2019,"Индекс-провайдер MSCI объявил результаты полугодового пересмотра индексов. По его итогам MSCI включил в индексы развивающихся стран (за исключением Китая) 25 новых компаний и исключил 14. Все изменения вступят в силу после закрытия торгов 26 ноября. ""Как мы и ожидали, в индексе MSCI Russia никаких изменений не произошло. Ближайшее событие – ребалансировка индекса MSCI Russia 10/40. Чтобы сместить NVTK LI с его четвертой позиции с весом в индексе 10%, TATN за время, оставшееся до даты отсечки (14 ноября), необходимо опередить его всего на 3%. По нашим оценкам, отток из российских акций, связанный с включением в индексы компаний других развивающихся стран, составит около $800 млн"", - прокомментировал главный стратег ""ВТБ Капитала"" Илья Питерский."
152,01.11.2019,"""Татнефть"" за 10 месяцев увеличила добычу на 2%",https://www.finam.ru/analysis/newsitem/tatneft-za-10-mesyacev-uvelichila-vyrabotku-nefti-do-24-6-mln-t-20191101-174234/,tatneft-3,17:42,01.11.2019,"Предприятия группы ""Татнефть"" в октябре 2019 года добыли 2 499 тыс. тонн нефти, за десять месяцев – 24 852 тыс. тонн, что на 506 тыс. больше, чем в 2018 году. В том числе ""Татнефть"" в октябре добыла 2 471 тыс. тонн, за десять месяцев – 24 578 тыс. тонн (+516 тыс. к 2018 году), говорится в сообщении компании. На лицензионных участках группы за пределами РТ в октябре было добыто 28,2 тыс. тонн, за десять месяцев –  273 тыс. тонн (-10 тыс. к 2018 году). Добыча сверхвязкой нефти в октябре составила 255 тыс. тонн, с начала года – 2222 тыс. тонн (+617 тыс. 2018 году). За десять месяцев 2019 года в новом бурении компанией было построено и сдано 596 скважин (в 2018 году – 496 скважин), в том числе эксплуатационное бурение – 470 скважин, бурение на битум – 113 скважин, разведочное бурение – 13 скважин. За десять месяцев 2019 года в бурении боковых стволов (БС) и боковых горизонтальных стволов (БГС) было сдано 62 скважины. На сегодняшний день в Самарской области, согласно плану, компания пробурила 8 эксплуатационных и 1 поисково-разведочную скважину, ведет бурение эксплуатационной скважины №346 и поисково-разведочной скважины №33 для ООО ""Татнефть-Самара"". В Ненецком автономном округе на сегодняшний день в бурении находится скважина №4р Северо-Хаяхинская. Скважины №5р Восточно-Хаяхинская, №6р Восточно-Хаяхинская и №3р Северо-Хаяхинская завершены бурением, ведется освоение. За десять месяцев года бригадами текущего, капитального ремонта скважин и ПНП на объектах ""Татнефти"" был произведен текущий ремонт на 8 774 скважинах (за октябрь – на 860); выполнен капитальный ремонт 2 103 скважин (за октябрь – 203). Гидроразрыв пласта произведен на 718 скважинах (за октябрь – на 75). На 1 494 скважинах (за октябрь – на 145) произведены работы по повышению нефтеотдачи пластов, в том числе химическими методами обработано 576 скважин (за октябрь – 55). В октябре 2019 года комплексом нефтеперерабатывающих и нефтехимических заводов ""ТАНЕКО"" было переработано 1029,5 тыс. тонн сырья, с начала года - 8800,97 тыс. тонн; в том числе в октябре было переработано 962,6 тыс. тонн нефтесырья, с начала года - 8162,4 тыс. тонн. В октябре 2019 года было произведено 966,03 тыс. тонн нефтепродуктов, с начала года - 8243,5 тыс. тонн. В том числе автобензинов в октябре было произведено 119,7 тыс. тонн, с начала года – 927,04 тыс. тонн; дизельного топлива - 315,6 тыс. тонн, с начала года – 3039,52 тыс. тонн."
153,01.11.2019,"""СИБУР"" закрыл сделку с ""Татнефтью"" по продаже нефтехимических производств в Тольятти",https://www.finam.ru/analysis/newsitem/sibur-zakryl-sdelku-s-tatneftyu-po-prodazhe-nefteximicheskix-proizvodstv-v-tolyatti-20191101-17242/,tatneft-3,17:24,01.11.2019,"""СИБУР"" закрыли сделку ""Татнефтью""  по продаже производственных и других активов в Тольятти, которые до сегодняшнего дня были объединены юридическими лицами ""СИБУР Тольятти"" и ""Тольяттисинтез"". Об этом сообщил ""СИБУР"". После приобретения активов ""Татнефть"" намерена продолжить их развитие в рамках реализации стратегии по газонефтехимии. ""СИБУР"" фокусируется на создании и развитии производств базовых полимеров глобальной мощности, перспективных среднетоннажных продуктов и премиальной специальной химии. ""СИБУР сфокусирован на долгосрочном развитии основной деятельности компании и повышении операционной эффективности бизнеса, - прокомментировал Павел Ляхович, член правления - управляющий директор ""СИБУРа"". – При этом мы останемся одним из партнеров производства в Тольятти""."
154,31.10.2019,"""Татнефть"" закрыла сделку с Neste",https://www.finam.ru/analysis/newsitem/tatneft-zakryla-sdelku-s-neste-20191031-16297/,tatneft-3,16:29,31.10.2019,"Сделка ""Татнефти"" и Neste была одобрена российскими антимонопольными органами 4 октября и была закрыта 31 октября 2019 года, сообщила Neste. Корпорация Neste в июле подписала соглашение о продаже ""Татнефти"" своего розничного топливного бизнеса в России, состоящего из 75 АЗС и терминала в Санкт-Петербурге. Стороны договорились, что цена сделки будет оставаться конфиденциальной."
